58,https://www.wikidata.org/wiki/Property:P58,$s <film> screenwriter was $o <person>,,,,,,,,,,,,,,,,,,,,,,,,,,,
fact,example,bool,example,bool_answer,example_output,set,example,set_projection,example_output,count,example,count_projection,example_output,argmin,example,argmin_projection,example_output,argmax,example,argmax_projection,example_output,min,example,min_projection,example_output,max,example,max_projection,example_output
$s was written by $o,Titanic was written by James Cameron,Did $o write the script for $s?,Did James Cameron write the script for Titanic?,TRUE,TRUE,Who wrote the script for $s?,Who wrote the script for Titanic?,$o,James Cameron,How many movies has $o written?,How many movies has James Cameron written?,$s,Titanic,Who has the written the fewest movie scripts?,Who has the written the fewest movie scripts?,$o [SEP] $s,James Cameron [SEP] Titanic,Who has written the most movie scripts?,Who has written the most movie scripts?,$o [SEP] $s,James Cameron [SEP] Titanic,,,,,,,,
$o wrote the script of $s,James Cameron wrote the script of Titanic,Did $o write $s?,Did James Cameron write Titanic?,TRUE,TRUE,The script for $s is written by who?,The script for Titanic is written by who?,$o,James Cameron,How many movies was $o involved in?,How many movies was James Cameron involved in?,$s,Titanic,Who has written the fewest screenplays?,Who has written the fewest screenplays?,$o [SEP] $s,James Cameron [SEP] Titanic,Who has written the most screenplays?,Who has written the most screenplays?,$o [SEP] $s,James Cameron [SEP] Titanic,,,,,,,,
The screenwriter for $s was $o,The screenwriter for Titanic was James Cameron,Did $o write the screenplay for $s?,Did James Cameron write the screenplay for Titanic?,TRUE,TRUE,Who is the screenwriter for $s?,Who is the screenwriter for Titanic?,$o,James Cameron,How many movies has $o written the screenplay for?,How many movies has James Cameron written the screenplay for?,$s,Titanic,Which movie has had the fewest writers,Which movie has had the fewest writers,$s [SEP] $o,Titanic [SEP] James Cameron,Which movie has had the most writers?,Which movie has had the most writers?,$s [SEP] $o,Titanic [SEP] James Cameron,,,,,,,,
,,Was $o involved in the making of $s?,Was James Cameron involved in the making of Titanic?,TRUE,TRUE,Who wrote the screenplay for $s?,Who wrote the screenplay for Titanic?,$o,James Cameron,How many writers were involved in $s?,How many writers were involved in Titanic?,$o,James Cameron,,,,,,,,,,,,,,,,
,,,,,,What films has $o written?,What films has James Cameron written?,$s,Titanic,,,,,,,,,,,,,,,,,,,,
,,,,,,$o has written which screenplays?,James Cameron has written which screenplays?,$s,Titanic,,,,,,,,,,,,,,,,,,,,
,,,,,,Which movies has $o written?,Which movies has James Cameron written?,$s,Titanic,,,,,,,,,,,,,,,,,,,,