35,https://www.wikidata.org/wiki/Property:P35,$ is the head of state of $o,,,,,,,,,,,,,,,,,,,,,,,,,,,
fact,example,bool,example,bool_answer,example_output,set,example,set_projection,example_output,count,example,count_projection,example_output,argmin,example,argmin_projection,example_output,argmax,example,argmax_projection,example_output,min,example,min_projection,example_output,max,example,max_projection,example_output
$s is head of state of $o.,Queen Elizabeth II is head of state of United Kingdom.,Is $s head of state of $o?,Is Queen Elizabeth II head of state of United Kingdom?,TRUE,TRUE,List the heads of state of $o,List the heads of state of United Kingdom,$s,Queen Elizabeth II,How many countries is $s head of state of?,How many countries is Queen Elizabeth II head of state of?,$o,United Kingdom,Which country has the fewest leaders?,Which country has the fewest leaders?,$o [SEP] $s,United Kingdom [SEP] Queen Elizabeth II,Which country has the most the leaders?,Which country has the most the leaders?,$o [SEP] $s,United Kingdom [SEP] Queen Elizabeth II,,,,,,,,
$s is the official with the highest formal authority in $o.,Queen Elizabeth II is the official with the highest formal authority in United Kingdom.,Is $o's head of state $s?,Is United Kingdom's head of state Queen Elizabeth II?,TRUE,TRUE,Who's in charge of $o?,Who's in charge of United Kingdom?,$s,Queen Elizabeth II,How many countries does $s rule?,How many countries does Queen Elizabeth II rule?,$o,United Kingdom,Which country has had the fewest leaders?,Which country has had the fewest leaders?,$o [SEP] $s,United Kingdom [SEP] Queen Elizabeth II,Which country has had the most leaders?,Which country has had the most leaders?,$o [SEP] $s,United Kingdom [SEP] Queen Elizabeth II,,,,,,,,
,,Is $s the official with the highest formal authority in $o?,Is Queen Elizabeth II the official with the highest formal authority in United Kingdom?,TRUE,TRUE,Who's the leader of $o?,Who's the leader of United Kingdom?,$s,Queen Elizabeth II,How many countries is $s the ruler of?,How many countries is Queen Elizabeth II the ruler of?,$o,United Kingdom,Who rules over the fewest countries?,Who rules over the fewest countries?,$s [SEP] $o,Queen Elizabeth II [SEP] United Kingdom,Who rules over the most countries?,Who rules over the most countries?,$s [SEP] $o,Queen Elizabeth II [SEP] United Kingdom,,,,,,,,
,,Is fhe official with the highest formal authority in $o $s?,Is fhe official with the highest formal authority in United Kingdom Queen Elizabeth II?,TRUE,TRUE,List the leaders of $o?,List the leaders of United Kingdom?,$s,Queen Elizabeth II,How many rulers does $o have?,How many rulers does United Kingdom have?,$s,Queen Elizabeth II,Who is head of state of the fewest places?,Who is head of state of the fewest places?,$s [SEP] $o,Queen Elizabeth II [SEP] United Kingdom,Who is head of state of the most places?,Who is head of state of the most places?,$s [SEP] $o,Queen Elizabeth II [SEP] United Kingdom,,,,,,,,
,,,,,,Where is $s the ruler?,Where is Queen Elizabeth II the ruler?,$o,United Kingdom,How many heads of states are in charge of $o?,How many heads of states are in charge of United Kingdom?,$s,Queen Elizabeth II,,,,,,,,,,,,,,,,
,,,,,,Who rules over $o?,Who rules over United Kingdom?,$s,Queen Elizabeth II,,,,,,,,,,,,,,,,,,,,