1082,https://www.wikidata.org/wiki/Property:P1082,"Population of $s <city, territory or country> is $o",,,,,,,,,,,,,,,,,,,,,,,,,,,
fact,example,bool,example,bool_answer,example_output,set,example,set_projection,example_output,count,example,count_projection,example_output,argmin,example,argmin_projection,example_output,argmax,example,argmax_projection,example_output,min,example,min_projection,example_output,max,example,max_projection,example_output
There are $o inhabitants of $s,There are 5079791 inhabitants of San Francisco,Is the population of $s $o?,Is the population of San Francisco 5079791?,TRUE,TRUE,,,,,How many people live in $s?,How many people live in San Francisco?,$o,5079791,Which place has the smallest population?,Which place has the smallest population?,$s [SEP] $o,San Francisco [SEP] 5079791,Which place has the biggest population?,Which place has the biggest population?,$s [SEP] $o,San Francisco [SEP] 5079791,What is the smallest population?,What is the smallest population?,$o,5079791,What is the largest population?,What is the largest population?,$o,5079791
The population of $s is $o,The population of San Francisco is 5079791,Are there $o people living in $s?,Are there 5079791 people living in San Francisco?,TRUE,TRUE,,,,,What is the population of $s?,What is the population of San Francisco?,$o,5079791,What is the least inhabited place?,What is the least inhabited place?,$s [SEP] $o,San Francisco [SEP] 5079791,What is the most inhabited place?,What is the most inhabited place?,$s [SEP] $o,San Francisco [SEP] 5079791,What is the lowest population?,What is the lowest population?,$o,5079791,What is the highest population?,What is the highest population?,$o,5079791
There are $o people living in $s,There are 5079791 people living in San Francisco,Is the number of people living in $s $o?,Is the number of people living in San Francisco 5079791?,TRUE,TRUE,,,,,,,,,What place has the fewest people living there?,What place has the fewest people living there?,$s [SEP] $o,San Francisco [SEP] 5079791,What place has the most people living there?,What place has the most people living there?,$s [SEP] $o,San Francisco [SEP] 5079791,,,,,,,,
,,Are there $o inhabitants of $s?,Are there 5079791 inhabitants of San Francisco?,TRUE,TRUE,,,,,,,,,,,,,,,,,,,,,,,,