57,https://www.wikidata.org/wiki/Property:P57,$o is the director of $s,,,,,,,,,,,,,,,,,,,,,,,,,,,
fact,example,bool,example,bool_answer,example_output,set,example,set_projection,example_output,count,example,count_projection,example_output,argmin,example,argmin_projection,example_output,argmax,example,argmax_projection,example_output,min,example,min_projection,example_output,max,example,max_projection,example_output
$s is directed by $o,Titanic is directed by James Cameron,Was $o the director of $s?,Was James Cameron the director of Titanic?,TRUE,TRUE,Which movies has $o directed?,Which movies has James Cameron directed?,$s,Titanic,How many movies has $o directed?,How many movies has James Cameron directed?,$s,Titanic,Which director has directed minimum number of movies?,Which director has directed minimum number of movies?,$o [SEP] $s,James Cameron [SEP] Titanic,Which director has directed maximum number of movies?,Which director has directed maximum number of movies?,$o [SEP] $s,James Cameron [SEP] Titanic,,,,,,,,
$s's director is $o,Titanic's director is James Cameron,Was $s directed by $o?,Was Titanic directed by James Cameron?,TRUE,TRUE,Which movies have been directed by $o?,Which movies have been directed by James Cameron?,$s,Titanic,How many directors does $s have?,How many directors does Titanic have?,$o,James Cameron,Who has directed minimum number of movies?,Who has directed minimum number of movies?,$o [SEP] $s,James Cameron [SEP] Titanic,Who has directed maximum number of movies?,Who has directed maximum number of movies?,$o [SEP] $s,James Cameron [SEP] Titanic,,,,,,,,
$o directed $s,James Cameron directed Titanic,Is $o director of $s?,Is James Cameron director of Titanic?,TRUE,TRUE,Who are the directors of $s?,Who are the directors of Titanic?,$o,James Cameron,,,,,,,,,,,,,,,,,,,,
$o is the director of $s,James Cameron is the director of Titanic,Did $o direct $s?,Did James Cameron direct Titanic?,TRUE,TRUE,,,,,,,,,,,,,,,,,,,,,,,,